"page_name","message"
"Breitbart","Christina Pushaw, Gov. Ron DeSantis' (R-FL) spokeswoman, hammered woke Disney on Monday, saying the politically woke company ""owns an island in the Bahamas"" where there's ""no same-sex marriage or civil unions under the law"" exists and ""people are not allowed to change gender."""
"CNN","Transgender high school students in Georgia are banned from competing on sports teams consistent with their gender identities after the state's high school association used a controversial new law to implement the restriction."
"CNN","""This lawsuit challenges a state statute that denies necessary medical care to children based solely on who they are,"" the Justice Department said in its complaint"
"CNN","Oklahoma Republican Gov. Kevin Stitt on Tuesday signed a new law that bans nonbinary gender markers on birth certificates in the state."
"Breitbart","“A Republican Congress must stand up for parental rights and parental choice. I think that’s a good idea. No teacher should ever be allowed to teach far left gender theories to our children without parental consent. It’s truly child abuse.”"
"CNN","A California man was arrested this week after he allegedly sent threatening online messages to the Merriam-Webster company over dictionary definitions containing references to gender identity, according to court documents."
"CNN","CNN's Michael Smerconish discusses Gov. Ron DeSantis (R-FL) retaliating against Disney over the company's response to a new law that limits certain classroom discussion on sexual orientation and gender identity."
"CNN","Florida Gov. Ron DeSantis on Friday signed several bills into law, including two measures into law targeting Disney, legislation that will put new restrictions on how schools and businesses can talk about race and gender, and the state's new congressional map."
"CNN","As they gear up for midterm elections, Republicans nationwide are intently focused on passing new restrictions on the LGBTQ community and, in particular, transgender kids"
"CNN","The Florida Department of Health is advising against any gender-affirming care for children and adolescents in new guidelines that are contrary to direction from major medical associations and federal health officials."
"Breitbart","The Biden administration is openly promoting ""gender-affirming"" healthcare, particularly for young people."
"Breitbart","""The term groomer is being used a lot today, imagine what goes through any parent's mind when you have some other adult talking to your kid about sexuality — and saying we're going to hide this conversation from your parents."""
"CNN","In recent months, conservative local and state officials have taken aim both at specific titles and broad categories of books that deal with race, gender or sexuality. And while attempts to remove those books from library shelves or classrooms haven’t all been successful, the efforts themselves have garnered interest in banned books from readers across the country."
"CNN","Transgender women and girls in Kentucky will no longer be allowed to compete on sports teams consistent with their gender at public and private schools in the state after lawmakers overrode a veto from their Democratic governor to enact the restrictive measure."
"CNN","The Pennsylvania House of Representatives on Tuesday passed a bill that would prohibit transgender girls and women in the state from competing on sports teams consistent with their gender -- a provision the state's Democratic governor has vowed to veto"
"Breitbart","As working class Americans struggle to remain afloat in the catastrophic Biden inflationary economy, Joe Biden is focused like a laser beam on making sure people can put an ""X"" in the gender box on their passports (for those who have enough money to actually travel)."
"CNN","Two families and two doctors are suing the state of Alabama following the passage of Senate Bill 184, which makes it a felony for a doctor to administer gender-affirming health care to minors"
"Breitbart","EDUCATION INSANITY: A model New Jersey state curriculum suggests students should begin learning about gender identity as early as the first or second grade."
"Breitbart","OUT OF CONTROL: Maryland ensures kindergartners are taught ""gender identities and expressions"" as part of its ""Family Life and Human Sexuality"" curriculum."
"CNN","Alabama's Republican-controlled legislature passed two bills on the last day of the session targeting transgender children, including one which makes it a felony for a doctor to administer gender-affirming health care to minors."
"CNN","Kentucky Gov. Andy Beshear vetoed a bill that would have prohibited transgender women and girls from competing on sports teams consistent with their gender at public and private schools in the state."
"CNN","""The parallel battles over how teachers address race, gender and sexual orientation and how libraries regulate access to books represent the broadest attempt to limit what students are taught since the 'loyalty oath' demands on teachers during the red scare period of the 1950s, or even the 'Scopes trial'-era laws banning the teaching of evolution during the 1920s"" | Analysis by Ronald Brownstein"
"Breitbart","“Disney’s idea of ‘equality’ is radically redefining gender and pushing sexual lesson plans to children while investing in countries that still harshly criminalize LGBT people for literally just existing.”"
"Breitbart","Joe Biden’s Department of Justice is warning states’ Attorneys General that it will go after what it considers discrimination if “transgender youth” are denied so-called “gender-affirming care,” including medical and drug treatments."
"CNN","Alaska Airlines announced that it has launched new, gender-neutral uniform guidelines for flight attendants"
"CNN","Two LGBTQ rights advocacy groups, as well as students, parents and a teacher in Florida, filed a federal lawsuit challenging the state's new law banning certain instruction about sexual orientation and gender identity in the classroom."
"CNN","Two LGBTQ rights advocacy groups, as well as students, parents and a teacher, filed a federal lawsuit challenging Florida's new law banning certain instruction about sexual orientation and gender identity in the classroom."
"Breitbart","As working class Americans struggle to afford groceries and gas in Biden’s disastrous inflationary economy, Biden celebrates transgenderism with a new “X” gender marker."
"CNN","Oklahoma Republican Gov. Kevin Stitt signed legislation banning transgender women and girls from competing on sports teams consistent with their gender at public schools, charter schools and colleges."
"Breitbart","Extreme-Left Disney ""filmed Mulan near #Uighur genocide camps & then thanked the people who run those camps in the credits,” Sen. Marco Rubio said. “But they are outraged that Florida schools will not be indoctrinating 5-year olds on ‘gender identity.'"""
"Breitbart","""...they support sexualizing kids in kindergarten. They support injecting woke gender ideology into second grade classrooms. They support enabling schools to ‘transition students’ to a ‘different gender’ without the knowledge of the parent..."""
"Breitbart","The woke, far-Left BLM-NFL has instituted a race and gender-based hiring system now. The NFL announced a new policy on Monday, requiring each team to hire a ""diverse person"" as an offensive assistant."
"CNN","Lawmakers in Arizona approved two bills on Thursday targeting transgender youth in the state, including one that would restrict access to gender-affirming health care. The measures now will go to Republican Gov. Doug Ducey for his signature."
"Breitbart","Ketanji Brown Jackson is to the left of former Justice Ruth Bader Ginsburg!"
"Breitbart","The lockdowns in Britain have reportedly coincided with a significant rise in the number of children seeking gender reassignment therapy."
"CNN","Indiana Republican Gov. Eric Holcomb vetoed a bill that would've prohibited transgender women and girls from competing on sports teams consistent with their gender at schools in the state, saying the legislation was too broadly written."
"CNN","A Texas appeals court reinstated a temporary injunction ensuring families seeking gender-affirming care for their trans children cannot be investigated by state authorities."
"Breitbart","LAUSD trains teachers in ""critical social justice gender ideology"" in part to ""address when students or staff make an ‘unacceptable’ errors. It was a “cult-retreat-like-experience” the LAUSD teacher who shared the information with Parents Defending Education (PDE) said. “The trainers called for us to raise our hands if we could commit to using preferred pronouns and STAND UP if we commit to using trans students’ preferred names.”"
"CNN","G7 governments respond to CNN’s exclusive poll"
"Breitbart","Feminist Slams Biden: ""Gender Identity"" Is Corporate Takeover of Humanity, You Are Complicit"
"Breitbart","California Governor Gavin Newsom (D) is attempting to use the controversy over Florida’s new bill restricting instruction on sexuality and gender in grades K-3 to woo Disney jobs back to the Golden State and its supposed culture of tolerance."
"CNN","Listen to CNN's 5 Things podcast for the latest on these top stories: ✔️ Thousands stranded in Mariupol, Ukraine ✔️ Biden administration lays out steps to close gender & racial wage gaps ✔️ Covid-19 lockdown in China https://cnn.it/3KJXRmP:=:https://www.cnn.com/audio/podcasts/5-things"
"CNN","""There's a grim reality in America: Being a mom is a greater predictor of wage and hiring discrimination than gender -- and due to structural racism, Black, Brown, Indigenous and other moms of color experience compounded wage and hiring discrimination,"" writes Kristin Rowe-Finkbeiner. ""The data is shocking."""
"CNN","What does the ""Don't Say Gay"" bill mean for Florida kids? If you missed the Sunday edition of CNN's 5 Things podcast, Steve Contorno examines the bill’s potential impact on instruction of gender identity and sexual orientation, along with its timing ahead of midterms. Listen here. https://cnn.it/3q3OfM1:=:https://www.cnn.com/audio/podcasts/5-things/episodes/ed5f52a4-0654-4e87-97d6-ae5500fe1cde"
"Breitbart","Leftist organization Together Rising is investing money and raising funds to help transgender youth advocacy organizations in Florida after the Sunshine State passed a bill prohibiting gender theory from being taught from kindergarten to third grade. “There’s no such thing as other people’s children."""
"CNN","Parents and advocates on Friday spoke out against Texas child welfare authorities investigating reports of transgender minors receiving gender-affirming health care, which the state considers as child abuse."
"CNN","Listen to CNN's 5 Things podcast for the latest on these top stories & more: ✔️ Russia's war plan ✔️ Texas decision today on kids' gender-affirming healthcare ✔️ Why is Denmark being criticized for taking in Ukrainian refugees?"
"Breitbart","As America sinks to $30,000,000,000,000.00+ in debt, and as working class Americans struggle to afford groceries and gas, Joe Biden wants to spend $2.6 billion to promote ""gender equity"" around the world."
"CNN","The proposals range from prohibiting instruction about gender identity in the classroom to restricting access to gender-affirming health care and excluding transgender youth from school athletics."
"Breitbart","FACT CHECK CLAIM: The Florida legislature “passed hateful legislation targeting vulnerable students” from “LGBTQI+” backgrounds. VERDICT: FALSE. The bill protects children from kindergarten through third grade from forced instruction on sexuality."
"CNN","Lawmakers in Florida have given final approval to a bill that would ban certain instruction about sexual orientation and gender identity in the classroom, sending the controversial bill to the desk of Republican Gov. Ron DeSantis."
"CNN","""After assessing the Attorney General's and Governor's actions, Texas Children's Hospital paused hormone-related prescription therapies for gender-affirming services. This step was taken to safeguard our healthcare professionals and impacted families from potential criminal legal ramifications,"" Texas Children's Hospital said in a statement."
"Breitbart","Republican Utah Gov. Spencer J. Cox has pledged to veto a bill requiring athletes to compete in sports according to their birth gender."
"CNN","Iowa's Republican governor approved legislation Thursday banning transgender women and girls from participating on sports teams consistent with their gender at accredited schools and colleges https://cnn.it/35ukqgn:=:https://www.cnn.com/2022/03/03/politics/iowa-transgender-sports-ban/index.html"
"CNN","The bills have become a major flashpoint in conservatives' nationwide push to give parents greater oversight over what students learn and discuss at school, but opponents have strongly denounced the legislation, saying they would have a harmful impact on LGBTQ youth. President Joe Biden has called the proposed ban ""hateful."""
"CNN","In a stunning legal opinion released publicly this week, Texas Attorney General Ken Paxton declared gender-affirming surgical procedures in children and prescribing drugs that affect puberty to be considered ""child abuse,"" a claim seen by many as an attack on transgender children."
"Breitbart","Caitlyn Jemner spoke amid reports that parents of students at California's Los Alamitos School District alleged biologically male counselors were allowed to sleep in the same cabins as fifth-grade girls at a school-organized science camp."
"CNN","""States where the GOP controls both the governorship and state legislature are moving in unprecedented numbers to restrict abortion, limit access to voting, ban books, retrench transgender rights and constrain teachers' ability to discuss race, gender and sexual orientation at public K-12 schools and increasingly at public colleges and universities,"" writes Ronald Brownstein | Analysis"
"CNN","While it’s hard to find data on people who are changing pronouns, anecdotal evidence suggests that more are ditching gendered words for those that are less gender-specific and more flexible across the board. https://cnn.it/3584i3C:=:https://edition.cnn.com/2022/02/19/health/pronouns-guide-for-parents-wellness/index.html"
"CNN","Texas Lieutenant Governor Dan Patrick spoke at a press conference Friday where he responded to a resolution by the Faculty Council at the University of Texas this week that affirmed the ""fundamental rights of faculty to academic freedom,"" including the teaching of race and gender theory."
"CNN","""The banned books engage their readers with a diversity of ideas and minority viewpoints, including with respect to race, gender, and sexual identity,"" the ACLU argues in the class action lawsuit."
"Breitbart","Adele proclaimed, ""We love being f**king females"" after coming under attack and being accused of transphobia for saying that she loves ""being a woman"" at the sex-neutral Brit Awards."
"Breitbart","""Crack cocaine and meth, whether you smoke it or inject it, will kill you. It doesn’t matter what color you are or what your gender is. Now, look — stupidity is a lot like pornography. It’s very hard to define, but you know it when you see it. This is stupidity.”"
"CNN","The White House on Tuesday condemned Republicans for advancing a controversial Florida bill that would ban certain discussions about sexual orientation and gender identity in the classroom, calling it part of a larger trend of GOP leaders across the country taking actions to treat students like political pawns."
"CNN","Florida Gov. Ron DeSantis appeared to voice support for a controversial state bill that would ban certain discussions about sexual orientation and gender identity in the classroom."
"CNN","US figure skaters Ashley Cain-Gribble and Timothy LeDuc bring a different story to the ice -- one based on equality. The pair stands out in their discipline, one rooted in traditional gender norms, through their performances and skating style https://cnn.it/3HyBr6R:=:https://www.cnn.com/2022/02/04/sport/ashley-cain-gribble-timothy-leduc-figure-skating-beijing-winter-olympics-spt-intl/index.html"
"CNN","Transgender women and girls in South Dakota will not be able to compete on sports teams consistent with their gender at accredited schools and colleges after the state's GOP governor enacted a ""fairness in women's sports"" law on Thursday."
"Breitbart","Florida parents have filed a lawsuit against Clay County Schools, claiming their 12-year-old daughter attempted suicide after having weekly meetings for months with a school counselor who affirmed her identity as a boy without the parents’ knowledge."
"Breitbart","""This is a hard woke left administration."""
"CNN","Florida state lawmakers advanced a bill that would prohibit some schools from ""encouraging"" conversations about sexual orientation and gender identity in classrooms with young students."
"CNN","A bill backed by Republican Gov. Ron DeSantis that would prohibit Florida's public schools and private businesses from making people feel ""discomfort"" or ""guilt"" based on their race, sex or national origin received first approval by the state's Senate Education Committee."
"CNN","Johnson's Biden then explained this virus has disrupted our lives, the holidays, gender reveal parties and ""wildfires that started as gender reveal parties."" https://cnn.it/3rlIqsT:=:https://www.cnn.com/2022/01/16/media/snl-cold-open-joe-biden-omicron/index.html"
"CNN","Johnson's Biden then explained this virus has disrupted our lives, the holidays, gender reveal parties and ""wildfires that started as gender reveal parties."""
"Breitbart","That settles it. The New York Times hath spoken. End of discussion."
"Breitbart","TikTok is promoting the hashtag #transgender to congregate videos about gender reassignment surgery and other topics, including how women living as men will feel better about menstruation if products are in masculine packaging."
